"","Var","Interpretacao"
"1","Cargo","A partir da análise do primeiro gráfico podemos observar que a frequência de todos os cargos é aproximadamente a mesma, todas em encontram no intervalo entre 90 e 118. Em seguida, vemos qual a proporção de mulheres e homens em cada um dos cargos, a grande maioria apresenta uma proporção próxima de 50%, com exceção dos Engenheiros de Software, Associados do Marketing e Gerentes, nesses casos a proporção de homens é igual a 92.7%, 9.3% e 80%, respectivamente. Ao avaliar o padrão dos boxplots em relação ao valor total recebido pela pessoa, podemos perceber que a distribuição dos boxplots pelos cargos é muito semelhante entre os gêneros. "
"2","Idade","De acordo com o histograma apresentado, é possível aferir que a idade dos membros da empresa é aleatorimente distribuída entre 18 e 65 anos. Para avaliar a proporção entre os gêneros, a variável foi categorizada, e como resultado, o gráfico indica que as proporções de gênero entre as diferentes faxias etárias são próximas de 50%, todas inclusas no intervalo entre 48% e 58.6%.  Com os boxplots apresentados ao lado, pode-se observar o comportamento do salário dos empregados segundo a faixa etária e seu gênero, nesse caso, em ambos gêneros o média salarial cresce a medida que o funcionário é mais velho, porém, a última faixa etária parece favorecer os homens."
"3","Perfomance","Primeiro, pode-se observar que a frequência de funcionários com todas as possibilidades de notas para Performance é aproximadamente igual, em que pessoas avaliadas com nota 2 forma observadas 192 vezes e pessoas que possuem nota 5 foram observadas 209 vezes. Apesar de todas as notas apresentaram pequeno desvio em relação a proporção de 50%, a amostra coletada mostra uma leve associação, em que quanto maior a nota, maior será a proporção de homens. Partindo para a análise de distribuição dos salários, vê-se que a variação nas notas não parece afetar significantemente o valor do salário, assim como o padrão dos salários são parecidos para ambos os gêneros."
"4","Titulo","Novamente, a frequência para todas as categorias é bastante similar, variando entre 238 e 265. Em cada uma das titulações também vê-se que a proporção entre os gêneros não é discrepante, pode-se observar que a menor razão de homens é igual a 49% e a maior proporção é igual a 58%. A distribuição dos salários é muito parecida entre os diferentes títulos e entre os gêneros."
"5","Departamento","Ao observar o primeiro gráfico tem-se que o departamento com o maior número de funcionários é o de Operação, com uma frequência igual a 210, enquanto que o menor setor observado na amostra possui frequência igual a 192, que é o departamento de Engenharia. A proporção entre homens e mulheres em todos os setores também é muito parecida e todas próximas de 50%. Pode-se avaliar também com os boxplots que os salários são igualmente distribuídos entre todos os setores e também entre os gêneros."
"6","Senioridade","Tal variável representa o números de anos em que o funcionário trabalha na compania. Vê-se que funcionários com 4 anos de experiência na empresa são menos frequentes que os demais tipos, com 184 observações, enquanto que a maior frequência se encontra com os funcionários com 3 anos de empresa, com valor igual a 219. De acordo com os gráficos empilhados, observa-se que a razão de funcionários homens e mulheres são todos parecidos e próximos de 50%. E ainda, ao avaliar a distribuição dos salários dos funcionárias vemos a mesma tendência de crescimento com o aumento de tempo na empresa."
